{
  "$schema": "https://json-schema.org/draft/2020-12/schema",
  "$id": "https://hendy-video-studio.local/schema/system-config.schema.json",
  "type": "object",
  "required": ["system", "network", "features", "ai", "storage", "editor", "theme", "managedFiles"],
  "properties": {
    "system": {
      "type": "object",
      "required": ["name", "version", "environment"],
      "properties": {
        "name": {"type": "string", "minLength": 1},
        "version": {"type": "string", "pattern": "^\\d+\\.\\d+\\.\\d+$"},
        "environment": {"enum": ["development", "staging", "production"]}
      },
      "additionalProperties": false
    },
    "network": {
      "type": "object",
      "required": ["sandboxPort", "backendPort", "frontendPort", "apiBasePath", "mcpPath"],
      "properties": {
        "sandboxPort": {"type": "integer", "minimum": 1024, "maximum": 65535},
        "backendPort": {"type": "integer", "minimum": 1024, "maximum": 65535},
        "frontendPort": {"type": "integer", "minimum": 1024, "maximum": 65535},
        "apiBasePath": {"type": "string", "pattern": "^/"},
        "mcpPath": {"type": "string", "pattern": "^/"}
      },
      "additionalProperties": false
    },
    "features": {"type": "object", "additionalProperties": {"type": "boolean"}},
    "ai": {
      "type": "object",
      "required": ["provider", "models", "temperature"],
      "properties": {
        "provider": {"type": "string"},
        "models": {"type": "object", "required": ["translation", "ocr", "stt"], "additionalProperties": {"type": "string"}},
        "temperature": {"type": "number", "minimum": 0, "maximum": 2}
      },
      "additionalProperties": false
    },
    "storage": {
      "type": "object",
      "required": ["provider", "bucketEnv", "zeroEgress"],
      "properties": {
        "provider": {"type": "string"},
        "bucketEnv": {"type": "string"},
        "zeroEgress": {"type": "boolean"}
      },
      "additionalProperties": false
    },
    "editor": {
      "type": "object",
      "required": ["audioChannels", "duckingGain", "transitionGapSeconds"],
      "properties": {
        "audioChannels": {"type": "array", "items": {"type": "string"}, "minItems": 1},
        "duckingGain": {"type": "number", "minimum": 0, "maximum": 1},
        "transitionGapSeconds": {"type": "number", "minimum": 0}
      },
      "additionalProperties": false
    },
    "theme": {
      "type": "object",
      "required": ["darkBackgroundColor", "darkContainerBackgroundColor", "accentColor", "textColor"],
      "properties": {
        "darkBackgroundColor": {"type": "string", "pattern": "^#[0-9a-fA-F]{6}$"},
        "darkContainerBackgroundColor": {"type": "string", "pattern": "^#[0-9a-fA-F]{6}$"},
        "accentColor": {"type": "string", "pattern": "^#[0-9a-fA-F]{6}$"},
        "textColor": {"type": "string", "pattern": "^#[0-9a-fA-F]{6}$"}
      },
      "additionalProperties": false
    },
    "managedFiles": {"type": "array", "items": {"type": "string"}, "uniqueItems": true}
  },
  "additionalProperties": false
}
